rakez_code,activity_name,description,licence_type,activity_group,isic_code,isic_title,isic_level,aml_rating,risk_score,risk_theme,cdd_edd,matched_rules,prohibited,zone,source,mapping_basis
749506,Labeling Labeling Services,"Includes firms engaged in relabeling in Arabic and English the goods and products which were imported with labels in other languages, it involves submitting such labels to the concerned authorities prior to re-sticking on these goods and products",Industrial,Packing services,749,"Other professional, scientific and technical activities n.e.c.",Group,Medium,2,Professional / technical services,Standard CDD + monitoring,,false,freezone,RAKEZ FZ list + ISIC Rev.5 AML mapping + rule library,RAKEZ code 749506 → ISIC 749 (Group)
5149-40,Laboratories Chemicals Trading,"Includes reselling of solutions and chemicals for scientific experiments and research, laboratory analysis, including organic and non- organic acids, alkaline, alcohol, salts, compounds elements, rocks, metals and other solid or liquid chemicals.",Commercial,Chemicals trading 9499002 Ladies Club Ladies Club Service Separate professional activities,51,Air transport,Division,Medium,2,Transportation / storage,Standard CDD + monitoring,,false,freezone,RAKEZ FZ list + ISIC Rev.5 AML mapping + rule library,RAKEZ code 5149-40 → ISIC 51 (Division)
519010,Laboratories Tools & Requisites Trading,"Includes reselling laboratory requisites for scientific and medical testing and analysis, including glassware, instruments, apparatuses other than chemical solutions and equipment.",Commercial,Medicines trading,51,Air transport,Division,Medium,2,Transportation / storage,Standard CDD + monitoring,,false,freezone,RAKEZ FZ list + ISIC Rev.5 AML mapping + rule library,RAKEZ code 519010 → ISIC 51 (Division)
242307,Laboratory Diagnostics Reagents Manufacturing,"Includes preparing lab reagents, solutions or solid like enzymes, clinical chemistry,strains or pregnency test strips respectively, these materials are used to diagnose diseases through blood inside labs or urine in labs or homes, reagents are prepared according to approved protocols and subject to approval by authorised medical authorities.",Industrial,Manufacturing of chemicals,242,Manufacture of basic precious and other non-ferrous metals,Group,Medium,2,Manufacturing,Standard CDD + monitoring,,false,freezone,RAKEZ FZ list + ISIC Rev.5 AML mapping + rule library,RAKEZ code 242307 → ISIC 242 (Group)
171104,Lace & Band Crochet Manufacturing,"Includes the process of weaving lace from natural and artificial yarns and fibers. It also includes the manufacture of other similar woven products such as crochet, brocades, woven belts, as well as ready made garment requisites such as cards, labels, brands, tapestry and others.",Industrial,Textiles & products manufacturing,17,Manufacture of paper and paper products,Division,Medium,2,Manufacturing,Standard CDD + monitoring,,false,freezone,RAKEZ FZ list + ISIC Rev.5 AML mapping + rule library,RAKEZ code 171104 → ISIC 17 (Division)
181005,Ladies’ Garments Manufacturing,"Includes the manufacture of ladies’ shirts and trousers, party and evening dresses, maternity clothes, wedding dresses, night and in-house wear, beach and bath wear, scarves and others.",Industrial,Manufacturing of garments and rugs,181,Printing and service activities related to printing,Group,Medium,2,Manufacturing,Standard CDD + monitoring,,false,freezone,RAKEZ FZ list + ISIC Rev.5 AML mapping + rule library,RAKEZ code 181005 → ISIC 181 (Group)
513112,Ladies’ Garments Trading,"Includes reselling ladies’ shirts and trousers, party and evening dresses, maternity clothes, wedding dresses, night and in-house wear, beach and bath wear, scarves and others.",Commercial,Ready made garments qroup,51,Air transport,Division,Medium,2,Transportation / storage,Standard CDD + monitoring,,false,freezone,RAKEZ FZ list + ISIC Rev.5 AML mapping + rule library,RAKEZ code 513112 → ISIC 51 (Division)
181006,Ladies’ Underwears Manufacturing,"Includes manufacturing women undergarments made of woven, knitted or crocheted fabric to be worn under other clothes, whether over or below the waist.",Industrial,Manufacturing of garments and rugs,181,Printing and service activities related to printing,Group,Medium,2,Manufacturing,Standard CDD + monitoring,,false,freezone,RAKEZ FZ list + ISIC Rev.5 AML mapping + rule library,RAKEZ code 181006 → ISIC 181 (Group)
315002,Lamp Base & Accessories Manufacturing,"Includes manufacturing lamp bases of ceramic, metal, glass or plastic, which make an electrical connection in the socket of a light fixtures.",Industrial,Appliances and machinery manufacturing,31,Manufacture of furniture,Division,Medium,2,Manufacturing,Standard CDD + monitoring,,false,freezone,RAKEZ FZ list + ISIC Rev.5 AML mapping + rule library,RAKEZ code 315002 → ISIC 31 (Division)
RAKEZ /2017/48,Landscape Design Professional Individual Works,,Individual / Professional,Others fields,N,"Professional, scientific and technical activities",Section,Medium,2,Professional / technical services,Standard CDD + monitoring,,false,freezone,RAKEZ FZ list + ISIC Rev.5 AML mapping + rule library,Activity name title match → ISIC N
742111,Landscaping Engineering Consultancy,"Includes firms specialized in drawing up designs, plans and specifications for beautification and organization of parks, lands and gardens and harmonizing beauties of the same with the neighboring buildings and natural scenes.",Service,Consultancy -A- Agriculture and Soil,742,Photographic activities,Group,Medium,2,Professional / technical services,Standard CDD + monitoring,,false,freezone,RAKEZ FZ list + ISIC Rev.5 AML mapping + rule library,RAKEZ code 742111 → ISIC 742 (Group)
100014,Language Interpretation Language Interpretation Media,,Media,Support Services,10,Manufacture of food products,Division,Medium,2,Manufacturing,Standard CDD + monitoring,,false,freezone,RAKEZ FZ list + ISIC Rev.5 AML mapping + rule library,RAKEZ code 100014 → ISIC 10 (Division)
809059,Language Training,"Includes institutions primarily engaged in offering language instruction, including sign language and cultural awareness. Educational Training Instititute /",Educational,consultancy,80,Investigation and security activities,Division,Medium,2,Security / investigation / private protection,Standard CDD + monitoring,,false,freezone,RAKEZ FZ list + ISIC Rev.5 AML mapping + rule library,RAKEZ code 809059 → ISIC 80 (Division)
515998,Laser & Fireworks Show Equipment Trading,"Includes reselling laser and fireworks show products such as, digital light processors, screens and projectors, high powered lighting units, video devices, loudspeaker systems, these firms are not allowed to deal in fireworks materials.",Commercial,Mechanical & engineering equipment trading,51,Air transport,Division,Medium,2,Transportation / storage,Standard CDD + monitoring,,false,freezone,RAKEZ FZ list + ISIC Rev.5 AML mapping + rule library,RAKEZ code 515998 → ISIC 51 (Division)
289919,Lathe Workshop,Includes workshops with lathes designed to machine metals.,Industrial,Steel workshop,28,Manufacture of machinery and equipment n.e.c.,Division,Medium,2,Manufacturing,Standard CDD + monitoring,,false,freezone,RAKEZ FZ list + ISIC Rev.5 AML mapping + rule library,RAKEZ code 289919 → ISIC 28 (Division)
515936,Laundry & Dry Cleaning Equipment Trading,"Includes reselling laundry machinery and equipment for cleaning and ironing clothes, textiles, linen, curtains, carpets and others, whether by steam or dry cleaning.",Commercial,Mechanical & engineering equipment trading,51,Air transport,Division,Medium,2,Transportation / storage,Standard CDD + monitoring,MH02,false,freezone,RAKEZ FZ list + ISIC Rev.5 AML mapping + rule library,RAKEZ code 515936 → ISIC 51 (Division)
809025,Law Training Services,"Includes providing all the services required to train legal employees such as deputies, advocates and clerks. The aim is to promote their knowledge in legal domain through planning training program (training manual), specialized workshops, sessions by training individuals and units to pass law expertise and enlighten on law versions and international treaties and conventions. Concerned firms are not allowed to grant degrees. Educational Training Instititute /",Educational,consultancy,80,Investigation and security activities,Division,Medium,2,Security / investigation / private protection,Standard CDD + monitoring,,false,freezone,RAKEZ FZ list + ISIC Rev.5 AML mapping + rule library,RAKEZ code 809025 → ISIC 80 (Division)
809036,Learning Difficulties Center,"Includes providing training and teaching for children with learning difficulties through programs of attention, auditory, visual discrimination motor skills, learning skills of reading, writing and mathematics, including also, early identification, diagnosing and perceptual tests. Educational Training Instititute /",Educational,consultancy,80,Investigation and security activities,Division,Medium,2,Security / investigation / private protection,Standard CDD + monitoring,,false,freezone,RAKEZ FZ list + ISIC Rev.5 AML mapping + rule library,RAKEZ code 809036 → ISIC 80 (Division)
741102,Legal Consultants,"Includes offices and firms which offer consultancies and prepare legal studies of the lawsuits and the legal questions submitted thereto. However, they are not entitled to assume the defense before courts in this regard.",Service,Legal services,741,Specialized design activities,Group,High,3,Professional / technical services,Enhanced Due Diligence (EDD),VH02; H05,false,freezone,RAKEZ FZ list + ISIC Rev.5 AML mapping + rule library,RAKEZ code 741102 → ISIC 741 (Group)
7499-27,Legal Translation,"Includes specialized offices engaged in providing written translation to documents and texts with contents of general nature or to texts of specific and professional nature, like commercial contracts, legal, commercial, technical and scientific texts. It also includes instant and simultaneous translations provided by specialized translators in meetings, seminars or conferences.",Service,translation group,7499,"All other professional, scientific and technical activities n.e.c.",Class,Medium,2,Professional / technical services,Standard CDD + monitoring,,false,freezone,RAKEZ FZ list + ISIC Rev.5 AML mapping + rule library,RAKEZ code 7499-27 → ISIC 7499 (Class)
6601-01,Life Insurance,Includes firms which execute all insurance operations related to human life and covering any danger to life.,Service,Insurance,66,Activities auxiliary to financial service and insurance activities,Division,High,3,Financial / insurance,Enhanced Due Diligence (EDD),,false,freezone,RAKEZ FZ list + ISIC Rev.5 AML mapping + rule library,RAKEZ code 6601-01 → ISIC 66 (Division)
519015,Life Saving Equipment Trading,"Includes reselling equipment for marine life saving such as life jackets, lifebuoys and boats, also the devices that ignite light, smoke and flare signals used to indicate the position of the distressed lifebuoys in day or night in order to enable rescuing.",Commercial,Mechanical & engineering equipment trading,51,Air transport,Division,Medium,2,Transportation / storage,Standard CDD + monitoring,,false,freezone,RAKEZ FZ list + ISIC Rev.5 AML mapping + rule library,RAKEZ code 519015 → ISIC 51 (Division)
291505,Lifts Assembling,"Includes manufacturing by means of assembling residential, commercial, industrial and servicing (cargo and garbage handling) lifts. The process may involve manufacturing some components such as bodies and cabins, fixing walls, roofs, floors as well as installing doors, motors and control systems. It also includes design (customized), installation and maintenance.",Industrial,Equipment and engines manufacturing,291,Manufacture of motor vehicles,Group,Medium,2,Manufacturing,Standard CDD + monitoring,,false,freezone,RAKEZ FZ list + ISIC Rev.5 AML mapping + rule library,RAKEZ code 291505 → ISIC 291 (Group)
515951,"Lifts, Escalators & Spare Parts Trading","Includes reselling lifts fixed in multistoried facilities to carry people and goods, also, escalators and electric belts in airports, shopping centers, hotels and public utilities.",Commercial,Mechanical & engineering equipment trading,51,Air transport,Division,Medium,2,Transportation / storage,Standard CDD + monitoring,,false,freezone,RAKEZ FZ list + ISIC Rev.5 AML mapping + rule library,RAKEZ code 515951 → ISIC 51 (Division)
5159-68,Light Aircraft Trading,"Includes reselling light aircraft with a maximum gross takeoff weight of 100,000 lbs and are used commercially for passenger and freight transport, sightseeing, photography and personal use.",Commercial,Mechanical & engineering equipment trading,51,Air transport,Division,Medium,2,Transportation / storage,Standard CDD + monitoring,MH01,false,freezone,RAKEZ FZ list + ISIC Rev.5 AML mapping + rule library,RAKEZ code 5159-68 → ISIC 51 (Division)
RAKEZ /2017/50,Light Archiving Professional Individual Works,,Individual / Professional,Information service activities,N,"Professional, scientific and technical activities",Section,Medium,2,Professional / technical services,Standard CDD + monitoring,,false,freezone,RAKEZ FZ list + ISIC Rev.5 AML mapping + rule library,Activity name title match → ISIC N
513917,Light Fittings & Fixtures Trading,"Includes reselling lighting lamps, ornamental ceiling lamps (except crystal chandeliers) switch keys and sockets. This also includes electric bells, spotlights, garden and house lighting device. Public parks and squares lightings are classified under Class 5150.",Commercial,Not Grouped,51,Air transport,Division,Medium,2,Transportation / storage,Standard CDD + monitoring,,false,freezone,RAKEZ FZ list + ISIC Rev.5 AML mapping + rule library,RAKEZ code 513917 → ISIC 51 (Division)
515930,Lighting Equipment & Requisites Trading,"Includes reselling lighting devices in public gardens, parks, squares, airports, sports stadium and others.",Commercial,Mechanical & engineering equipment trading,51,Air transport,Division,Medium,2,Transportation / storage,Standard CDD + monitoring,,false,freezone,RAKEZ FZ list + ISIC Rev.5 AML mapping + rule library,RAKEZ code 515930 → ISIC 51 (Division)
315007,Lighting Fitting & Fixtures Assembling,"Includes assembling lighting devices in public gardens, parks, airports, sports stadium and others.",Industrial,Lighting equipment manufacturing1,31,Manufacture of furniture,Division,Medium,2,Manufacturing,Standard CDD + monitoring,,false,freezone,RAKEZ FZ list + ISIC Rev.5 AML mapping + rule library,RAKEZ code 315007 → ISIC 31 (Division)
514324,Lighting Poles Trading,"Includes reselling utility lighting poles made of metal, concrete or wood for roads, streets and parks lighting.",Commercial,Building materials trading,51,Air transport,Division,Medium,2,Transportation / storage,Standard CDD + monitoring,,false,freezone,RAKEZ FZ list + ISIC Rev.5 AML mapping + rule library,RAKEZ code 514324 → ISIC 51 (Division)
1549-14,Liquid Pasteurized Egg Production,"Includes processing pasteurized egg liquid and packaging in bulks for using by consumers like restaurants, hotels and catering companies.",Industrial,Food industries,15,Manufacture of leather and related products,Division,Medium,2,Manufacturing,Standard CDD + monitoring,,false,freezone,RAKEZ FZ list + ISIC Rev.5 AML mapping + rule library,RAKEZ code 1549-14 → ISIC 15 (Division)
154914,Liquid Pasteurized Egg Production,"Includes processing pasteurized egg liquid and packaging in bulks for using by consumers like restaurants, hotels and catering companies.",Industrial,Food industries,15,Manufacture of leather and related products,Division,Medium,2,Manufacturing,Standard CDD + monitoring,,false,freezone,RAKEZ FZ list + ISIC Rev.5 AML mapping + rule library,RAKEZ code 154914 → ISIC 15 (Division)
100019,Live Theatrical Shows Management and Promotion,Live Theatrical Shows Management and Promotion,Media,Event Management,10,Manufacture of food products,Division,Medium,2,Manufacturing,Standard CDD + monitoring,,false,freezone,RAKEZ FZ list + ISIC Rev.5 AML mapping + rule library,RAKEZ code 100019 → ISIC 10 (Division)
242207,lnk Mixing & Refilling,Includes proportionally mix and blend inks to produce a colour required by the customer,Industrial,Manufacturing of chemicals,242,Manufacture of basic precious and other non-ferrous metals,Group,Medium,2,Manufacturing,Standard CDD + monitoring,,false,freezone,RAKEZ FZ list + ISIC Rev.5 AML mapping + rule library,RAKEZ code 242207 → ISIC 242 (Group)
809031,Local Handicrafts Training Center,"Includes providing training on items made by hand originating among the people (community) of UAE, often with the use of simple tools, and is generally artistic and traditional in nature. They are also objects of utility and objects of decoration. Educational Training Instititute /",Educational,consultancy,80,Investigation and security activities,Division,Medium,2,Security / investigation / private protection,Standard CDD + monitoring,,false,freezone,RAKEZ FZ list + ISIC Rev.5 AML mapping + rule library,RAKEZ code 809031 → ISIC 80 (Division)
5520-09,Local Sweets Preparing,Includes preparing local sweets in stalls sell directly to the public for immediate consumption,Commercial,Restaurants and coffee shops,5520,Other short term accommodation activities,Class,Medium,2,Accommodation / food services,Standard CDD + monitoring,,false,freezone,RAKEZ FZ list + ISIC Rev.5 AML mapping + rule library,RAKEZ code 5520-09 → ISIC 5520 (Class)
289303,Locks & Keys Manufacturing,"Includes manufacturing the mechanical Includes manufacturing the mechanical or electronic fastening devices as well as the keys, keycards, fingerprints and security tokens which release them. or electronic fastening devices as well as the keys, keycards, fingerprints and security tokens which release them. Industrial",Industrial,,28,Manufacture of machinery and equipment n.e.c.,Division,Medium,2,Manufacturing,Standard CDD + monitoring,,false,freezone,RAKEZ FZ list + ISIC Rev.5 AML mapping + rule library,RAKEZ code 289303 → ISIC 28 (Division)
514338,Locks & Keys Trading,"Includes reselling the mechanical or electronic fastening device which are released by a physical object, such as key, keycard, fingerprint, security token.",Commercial,Building materials trading,51,Air transport,Division,Medium,2,Transportation / storage,Standard CDD + monitoring,,false,freezone,RAKEZ FZ list + ISIC Rev.5 AML mapping + rule library,RAKEZ code 514338 → ISIC 51 (Division)
RAKEZ /2017/07,Logistics & Transportation,Logistics & Transportation,Service,"Transport, shipping and storage",H,Transportation and storage,Section,Medium,2,Transportation / storage,Standard CDD + monitoring,MH01,false,freezone,RAKEZ FZ list + ISIC Rev.5 AML mapping + rule library,Activity name title match → ISIC H
741426,Logistics Consultancy,"Includes firms specialized in providing objective management advice and solutions to supply chain problems as well as providing methodology for improving performance, this involves analyzing the distribution network and delivering practical solutions, facilities and warehouses design and improvement, audit the operation and identify the potentials for improvements.",Service,"Consultancy -D- management, information and marketing",741,Specialized design activities,Group,Medium,2,Professional / technical services,Standard CDD + monitoring,MH01,false,freezone,RAKEZ FZ list + ISIC Rev.5 AML mapping + rule library,RAKEZ code 741426 → ISIC 741 (Group)
RAKEZ /2017/34,Logo Design Professional,"Individual Works Individual / Professional Design,",Media,& Architecture,N,"Professional, scientific and technical activities",Section,Medium,2,Professional / technical services,Standard CDD + monitoring,,false,freezone,RAKEZ FZ list + ISIC Rev.5 AML mapping + rule library,Activity name title match → ISIC N
232008,Lubricants & Grease Refilling,Includes firms engaged in breaking bulk Lubricants and Grease in smaller lots consumer or commercial packs.,Industrial,Manufacture of petroleum products,23,Manufacture of other non-metallic mineral products,Division,High,3,Manufacturing,Enhanced Due Diligence (EDD),H08,false,freezone,RAKEZ FZ list + ISIC Rev.5 AML mapping + rule library,RAKEZ code 232008 → ISIC 23 (Division)
514102,Lubricants & Grease Trading,includes reselling the high viscosity oil based lubricating substances used for lessening friction in the working parts of a mechanism in order to protect against wear and Transfer heat.,Commercial,Fuel and petroleum products trading,51,Air transport,Division,High,3,Transportation / storage,Enhanced Due Diligence (EDD),H08,false,freezone,RAKEZ FZ list + ISIC Rev.5 AML mapping + rule library,RAKEZ code 514102 → ISIC 51 (Division)
6023-18,Lubricants & Petroleum Wastes Transport,"Includes using light and heavy tankers which are duly fitted to transport Lubricants and Petroleum Wastes that are considered risky to human beings and environment, and which require adherence to stringent measures in transporting.",Commercial,"Transport, shipping and storage 9312002 Marine Sports Club Marine Sports Club Service Sport Club",602,"Television programming, broadcasting and video distribution activities",Group,Medium,2,Publishing / content,Standard CDD + monitoring,MH01,false,freezone,RAKEZ FZ list + ISIC Rev.5 AML mapping + rule library,RAKEZ code 6023-18 → ISIC 602 (Group)
100078,Magazines,Magazines,Media,Publishing,10,Manufacture of food products,Division,Medium,2,Manufacturing,Standard CDD + monitoring,,false,freezone,RAKEZ FZ list + ISIC Rev.5 AML mapping + rule library,RAKEZ code 100078 → ISIC 10 (Division)
515987,Magnetic Technology Equipment Trading,"Includes selling magnetic technology equipment and systems which are involved in the application of agriculture and animal resources, thermal energy, constructions, water treatment, chemical and oil industries…etc.",Industrial,Mechanical & engineering equipment trading,51,Air transport,Division,Medium,2,Transportation / storage,Standard CDD + monitoring,,false,freezone,RAKEZ FZ list + ISIC Rev.5 AML mapping + rule library,RAKEZ code 515987 → ISIC 51 (Division)
809020,Management & Administration Training,"Includes providing training on planning, directing and operating the managerial activities of organizations and institutions, with emphasis on administration, economics, finance, it involves managing various operations related to education, employment, logistics, management science, offices, organizational theory and behavior, personnel…etc. Educational Training Instititute /",Educational,consultancy,80,Investigation and security activities,Division,Medium,2,Security / investigation / private protection,Standard CDD + monitoring,MH01,false,freezone,RAKEZ FZ list + ISIC Rev.5 AML mapping + rule library,RAKEZ code 809020 → ISIC 80 (Division)
741405,Management Consultancies,"Includes providing administrative consultancies and studies to public departments and companies as regarding administrative performance analysis, procedural engineering, laying out flow-charts and related documents circulation, internal policy formulation, organizational restructuring, strategic plans development, innovating work procedures, designing balanced scorecards, such firms are not allowed to conduct field surveys and questionnaire before getting approval from the competent authority.",Service,"Consultancy -D- management, information and marketing",741,Specialized design activities,Group,Medium,2,Professional / technical services,Standard CDD + monitoring,,false,freezone,RAKEZ FZ list + ISIC Rev.5 AML mapping + rule library,RAKEZ code 741405 → ISIC 741 (Group)
701014,Management of Self Owned Properties,"Includes firms engaged in managing self owned residential units, also handling contractual arrangement with the firms in charged of maintenance & security. Such firms are not allowed to practice real estate brokerage.",Business Invest,Real estate 9312025 Motorcycle Club Motorcycle Club Service Sport Club,7010,Activities of head offices,Class,High,3,Professional / technical services,Enhanced Due Diligence (EDD),H02; H03,false,freezone,RAKEZ FZ list + ISIC Rev.5 AML mapping + rule library,RAKEZ code 701014 → ISIC 7010 (Class)
172900,Manufacture Of Other Textiles,Includes manufacturing the textiles that have no separate activities.,Industrial,Manufacturing of garments and rugs,17,Manufacture of paper and paper products,Division,Medium,2,Manufacturing,Standard CDD + monitoring,,false,freezone,RAKEZ FZ list + ISIC Rev.5 AML mapping + rule library,RAKEZ code 172900 → ISIC 17 (Division)
742134,Manufacturing & Material Engineering Consultancy,"Includes providing engineering support and services to steel and metal plants with regard to thermal dynamics, material engineering, interaction engineering, thermal and matter transmission.",Service,Other engineering services,742,Photographic activities,Group,Medium,2,Professional / technical services,Standard CDD + monitoring,,false,freezone,RAKEZ FZ list + ISIC Rev.5 AML mapping + rule library,RAKEZ code 742134 → ISIC 742 (Group)
RAKEZ /2017/40,Manufacturing Design Professional Individual Works,,Individual / Professional,Engineering & Science,C,Manufacturing,Section,Medium,2,Manufacturing,Standard CDD + monitoring,,false,freezone,RAKEZ FZ list + ISIC Rev.5 AML mapping + rule library,Activity name title match → ISIC C
514340,Marble & Natural Stones Trading,"Includes reselling varieties of marbles and natural stones like granite, basalt, limestone, this activity is limited to firms that trade these materials as crude before any conversional processes except cutting in blocks or slabs for transport purposes.",Commercial,Building materials trading,51,Air transport,Division,Medium,2,Transportation / storage,Standard CDD + monitoring,,false,freezone,RAKEZ FZ list + ISIC Rev.5 AML mapping + rule library,RAKEZ code 514340 → ISIC 51 (Division)
