rakez_code,activity_name,description,licence_type,activity_group,isic_code,isic_title,isic_level,aml_rating,risk_score,risk_theme,cdd_edd,matched_rules,prohibited,zone,source,mapping_basis
100094,Radio Station-Satellite,Radio Station-Satellite,Media,Broadcasting Radio,10,Manufacture of food products,Division,Medium,2,Manufacturing,Standard CDD + monitoring,,false,freezone,RAKEZ FZ list + ISIC Rev.5 AML mapping + rule library,RAKEZ code 100094 → ISIC 10 (Division)
100096,Radio Station-Terrestrial,Radio Station-Terrestrial,Media,Broadcasting Radio,10,Manufacture of food products,Division,Medium,2,Manufacturing,Standard CDD + monitoring,,false,freezone,RAKEZ FZ list + ISIC Rev.5 AML mapping + rule library,RAKEZ code 100096 → ISIC 10 (Division)
515914,"Radio, T .V. Stations, Cinema & Theatre Equipment Trading","Includes reselling of cameras, lightings, projectors, loudspeakers and montage systems used in broadcasting stations and television studios, as well as cinema and theater and radio and television transmission.",Commercial,Mechanical & engineering equipment trading,51,Air transport,Division,Medium,2,Transportation / storage,Standard CDD + monitoring,,false,freezone,RAKEZ FZ list + ISIC Rev.5 AML mapping + rule library,RAKEZ code 515914 → ISIC 51 (Division)
742164,Railway Development Engineering Consultancy,"Includes providing engineering consultancies and services with regard to setting up and develop railway framework, including project feasibility studies, track design and specification, civil engineering and construction, strategic operations planning, maintenance management, demand forecasting, impact of noise and vibration and pollution on environment, overall project development & management",Service,Consultancy -B- Engineering,742,Photographic activities,Group,Medium,2,Professional / technical services,Standard CDD + monitoring,MH05,false,freezone,RAKEZ FZ list + ISIC Rev.5 AML mapping + rule library,RAKEZ code 742164 → ISIC 742 (Group)
514939,Raw Materials Trading,"Includes reselling of mineral ores and organic raw materials used in manufacturing and handcrafting and which are only exploitable after going treatments, extraction or formation processes, they involve pulpwood to make papers, shells for shell handicrafts, extracts and natural herbs for perfumes, medicines and cosmetics, also minerals ores such as sand and rocks for extracting metals, salts and other similar raw materials. This activity does not include what being processed, manufactured or sem",Commercial,Chemicals trading,51,Air transport,Division,Medium,2,Transportation / storage,Standard CDD + monitoring,,false,freezone,RAKEZ FZ list + ISIC Rev.5 AML mapping + rule library,RAKEZ code 514939 → ISIC 51 (Division)
742157,Raw-Materials Composition Engineering Consultancy,Includes providing services and consultancies related to the substances or components of the raw materials which have certain physical properties that are used as inputs to production or manufacturing in order to to ensure compliance with the relevant industry standards.,Service,Other engineering services,742,Photographic activities,Group,Medium,2,Professional / technical services,Standard CDD + monitoring,,false,freezone,RAKEZ FZ list + ISIC Rev.5 AML mapping + rule library,RAKEZ code 742157 → ISIC 742 (Group)
269506,Ready Mixed Concrete Manufacturing,"Includes the concrete that is manufactured in a factory or batching plant, according to a set recipe, and then delivered to a work site by truck mounted in transit mixers.",Industrial,Block and building stones industry,26,"Manufacture of computer, electronic and optical products",Division,Medium,2,Manufacturing,Standard CDD + monitoring,,false,freezone,RAKEZ FZ list + ISIC Rev.5 AML mapping + rule library,RAKEZ code 269506 → ISIC 26 (Division)
513107,Readymade Garments Trading,"Includes reselling outerwear and underwear for men, women and children such as coats, suits, jackets, skirts, shirts, trousers, shorts, coats, gloves, swimming wear, socks.",Commercial,Ready made garments qroup,51,Air transport,Division,Medium,2,Transportation / storage,Standard CDD + monitoring,,false,freezone,RAKEZ FZ list + ISIC Rev.5 AML mapping + rule library,RAKEZ code 513107 → ISIC 51 (Division)
514326,Readymix Concrete Trading,"Includes reselling the concrete is manufactured in a factory or batching plant, according to a set recipe, and then delivered to a work site, by mixers mounted on trucks.",Commercial,Building materials trading,51,Air transport,Division,Medium,2,Transportation / storage,Standard CDD + monitoring,,false,freezone,RAKEZ FZ list + ISIC Rev.5 AML mapping + rule library,RAKEZ code 514326 → ISIC 51 (Division)
741404,Real Estate Consultancies,"Includes providing sound advice to potential buyers as well as developing strategies to achieve their goals and objectives, it involves showing properties, analyzing sales statistics, sourcing appraisers, referring mortgage service providers, contractors and renovation providers, examining contracts before making offers, closing and escrow expertise.",Service,"Consultancy -D- management, information and marketing",741,Specialized design activities,Group,High,3,Professional / technical services,Enhanced Due Diligence (EDD),H01; H03,false,freezone,RAKEZ FZ list + ISIC Rev.5 AML mapping + rule library,RAKEZ code 741404 → ISIC 741 (Group)
RAKEZ /2017/09,Real Estate Consultancy,Real Estate Consultancy,Service,Real estate,M,Real estate activities,Section,High,3,Real estate,Enhanced Due Diligence (EDD),H03,false,freezone,RAKEZ FZ list + ISIC Rev.5 AML mapping + rule library,Activity name title match → ISIC M
514103,Refined Oil Products Trading,"Includes reselling of oil products derived from converting crude oil in refineries to use in petrochemical industries, including methanol, urea, olivine and others, or fuels of motor vehicles, airplanes such as gasoline, kerosene, diesel, fuel oil, sulfur and nitrogen compounds, or heavy products such as tar, fuel , heavy oil, lubricating oil, wax and other products not detailed in this class.",Commercial,Fuel and petroleum products trading,51,Air transport,Division,High,3,Transportation / storage,Enhanced Due Diligence (EDD),H08,false,freezone,RAKEZ FZ list + ISIC Rev.5 AML mapping + rule library,RAKEZ code 514103 → ISIC 51 (Division)
261008,"Reflective, Enamelled & Insulant Glass Production","Includes processing glass sheets by means of enameling with reflective material to acquire the ability of reflecting sunlight and heat. It also includes coating glass sheets with the required material to act as an insulator against heat, sound and strong light or others.",Industrial,Glass industries,261,Manufacture of electronic components and boards,Group,Medium,2,Manufacturing,Standard CDD + monitoring,,false,freezone,RAKEZ FZ list + ISIC Rev.5 AML mapping + rule library,RAKEZ code 261008 → ISIC 261 (Group)
342003,Refrigerated Trailers Manufacturing,Includes manufacturing the refrigerator truck designed to carry perishable freight at specific temperatures which can be equipped with any one of a variety of mechanical refrigeration systems powered diesel engines.,Industrial,"Manufacture of motor vehicles, motorcycles & its spare parts",C,Manufacturing,Section,Medium,2,Manufacturing,Standard CDD + monitoring,MH01,false,freezone,RAKEZ FZ list + ISIC Rev.5 AML mapping + rule library,Activity name title match → ISIC C
515912,Refrigeration & Cold Storage Equipment Trading,"Includes reselling central foodstuff, medicines and chemicals coolers or freezers, including cold compartments, and freezers used for cold storage in groceries and supermarkets, household refrigerators and freezers are classified under activity 5139-15).",Commercial,Mechanical & engineering equipment trading,51,Air transport,Division,Medium,2,Transportation / storage,Standard CDD + monitoring,MH01,false,freezone,RAKEZ FZ list + ISIC Rev.5 AML mapping + rule library,RAKEZ code 515912 → ISIC 51 (Division)
293003,"Refrigerators, Freezers & Water Coolers Manufacturing","Includes manufacturing refrigerators, freezers, water coolers for household and commercial and industrial use.",Industrial,Appliances and machinery manufacturing,2930,Manufacture of parts and accessories for motor vehicles,Class,Medium,2,Manufacturing,Standard CDD + monitoring,,false,freezone,RAKEZ FZ list + ISIC Rev.5 AML mapping + rule library,RAKEZ code 293003 → ISIC 2930 (Class)
513915,"Refrigerators, Washing Machines & Household Electrical Appliances Trading","Includes reselling refrigerators, freezers, water coolers, washing machines and dryers, dishwashers, vacuum cleaners, ironers, heaters, also, electric kitchenwares such as mixers, mincers, cutters, blenders, toasters, juice extractors, grinders, kettles, small scales and other household appliances.",Commercial,Electronics group,51,Air transport,Division,Medium,2,Transportation / storage,Standard CDD + monitoring,,false,freezone,RAKEZ FZ list + ISIC Rev.5 AML mapping + rule library,RAKEZ code 513915 → ISIC 51 (Division)
514301,Reinforcement Steel Bars Trading,Includes reselling steel bars commonly used as a tensioning device in reinforced concrete structures holding the concrete in compression.,Commercial,Building materials trading,51,Air transport,Division,Medium,2,Transportation / storage,Standard CDD + monitoring,,false,freezone,RAKEZ FZ list + ISIC Rev.5 AML mapping + rule library,RAKEZ code 514301 → ISIC 51 (Division)
281110,Reinforcement Steel Fabrication,"Includes the process of cutting stainless steel and malleable steel bars in different sizes and forms to produce cylindrical shapes, columns or nets used in reinforcing of buildings, constructions and other ferroconcrete works.",Industrial,Structural steel manufacturing,2811,"Manufacture of engines and turbines, except aircraft, vehicle and cycle engines",Class,Medium,2,Manufacturing,Standard CDD + monitoring,,false,freezone,RAKEZ FZ list + ISIC Rev.5 AML mapping + rule library,RAKEZ code 281110 → ISIC 2811 (Class)
802203,Religious Studies School,Includes the type of institutions on the intermediate or secondary level where Islamic religious education is more predominant than academic education.,Educational,Schools / Early Learning Centre,80,Investigation and security activities,Division,High,3,Security / investigation / private protection,Enhanced Due Diligence (EDD),H09,false,freezone,RAKEZ FZ list + ISIC Rev.5 AML mapping + rule library,RAKEZ code 802203 → ISIC 80 (Division)
319001,Remote Control Systems Manufacturing,"Includes manufacturing guiding devices for navigating flying or moving objects and such as planes, boats, vehicles and others by transmitted signals remotely controled systems.",Industrial,Appliances and machinery manufacturing,31,Manufacture of furniture,Division,Medium,2,Manufacturing,Standard CDD + monitoring,,false,freezone,RAKEZ FZ list + ISIC Rev.5 AML mapping + rule library,RAKEZ code 319001 → ISIC 31 (Division)
731004,Renewable Energy Engineering Consultancy,"Includes conducting engineering consultancy and services regarding utilizing renewable energy specially winds, tidal waves, solar energy, hydrogen, as a clean alternative to traditional energy, it involves technical and economic feasibility studies, identify alternatives as well as preparing architectural designs and supervise execution.",Service,"Consultancy -D- management, information and marketing",7310,Advertising activities,Class,Medium,2,Professional / technical services,Standard CDD + monitoring,,false,freezone,RAKEZ FZ list + ISIC Rev.5 AML mapping + rule library,RAKEZ code 731004 → ISIC 7310 (Class)
749502,Repackaging & Refilling,"Includes firms engaged in the repackaging and bottling of bulky solid or liquid products which are elsewhere manufactured, in consumer or commercial packs to make ready for final consumption or export.",Industrial,Packing services,749,"Other professional, scientific and technical activities n.e.c.",Group,Medium,2,Professional / technical services,Standard CDD + monitoring,MH01,false,freezone,RAKEZ FZ list + ISIC Rev.5 AML mapping + rule library,RAKEZ code 749502 → ISIC 749 (Group)
100039,Research and Information Services,Research and Information Services,Media,Business Information,10,Manufacture of food products,Division,Medium,2,Manufacturing,Standard CDD + monitoring,,false,freezone,RAKEZ FZ list + ISIC Rev.5 AML mapping + rule library,RAKEZ code 100039 → ISIC 10 (Division)
5510-08,Resort,"Includes firms specialized in providing accommodation facilities, including beach cabins and flats for a short-stay in tourist destinations whether in beaches or mountains, beside a suitable accommodation, which may be taken on rental or on daily charge bases, all other tourist services are provided.",Service,Tourism Activites,5510,Hotels and similar accommodation activities,Class,Medium,2,Accommodation / food services,Standard CDD + monitoring,MH02,false,freezone,RAKEZ FZ list + ISIC Rev.5 AML mapping + rule library,RAKEZ code 5510-08 → ISIC 5510 (Class)
5520-01,Restaurant,"Includes restaurants equipped with the suitable installations to prepare and serve food and snacks inside, as well as various beverages for immediate consumption by the public.",Commercial,Restaurants and coffee shops,5520,Other short term accommodation activities,Class,Medium,2,Accommodation / food services,Standard CDD + monitoring,MH02,false,freezone,RAKEZ FZ list + ISIC Rev.5 AML mapping + rule library,RAKEZ code 5520-01 → ISIC 5520 (Class)
5520-14,Restaurant & Mini Store,"Includes restaurants equipped with the suitable installations to prepare and serve food and snacks inside, such firms are allowed also to sell some consumer goods such as fresh, preserved and canned foodstuff, beverages, dairy and bakery products as well as newspapers and magazines, the sale of such goods should not predominate the role of the restaurant.",Commercial,Restaurants and coffee shops,5520,Other short term accommodation activities,Class,Medium,2,Accommodation / food services,Standard CDD + monitoring,MH02,false,freezone,RAKEZ FZ list + ISIC Rev.5 AML mapping + rule library,RAKEZ code 5520-14 → ISIC 5520 (Class)
1531-05,Rice Husking & Polishing,"Includes removing husks from the paddy to render it consumable, it involves the protective layer surrounding the grain to produce brown rice, then removing the germ and bran layers from the grain to produce white rice.",Industrial,Foodstuff mills and packaging,15,Manufacture of leather and related products,Division,Medium,2,Manufacturing,Standard CDD + monitoring,,false,freezone,RAKEZ FZ list + ISIC Rev.5 AML mapping + rule library,RAKEZ code 1531-05 → ISIC 15 (Division)
281104,Rigs & Oilfield Platforms Manufacturing,"Includes manufacturing metal and concrete offshore oil platform to extract and process oil and natural gas from offshore oilfields, these platforms usually contain facilities to house the workforce, they are either built on artificial islands, floating or fixed to the ocean.",Industrial,Structural steel manufacturing,2811,"Manufacture of engines and turbines, except aircraft, vehicle and cycle engines",Class,Medium,2,Manufacturing,Standard CDD + monitoring,MH06,false,freezone,RAKEZ FZ list + ISIC Rev.5 AML mapping + rule library,RAKEZ code 281104 → ISIC 2811 (Class)
742102,Road & Traffic Engineering Consultancy,"Includes firms specialized in offering engineering services related to roads, traffic and their precise specializations. These services also include the elaboration of studies, designs, plans and technical specifications for bridges, tunnels, pedestrian accesses and motion studies etc.",Service,Other engineering services,742,Photographic activities,Group,Medium,2,Professional / technical services,Standard CDD + monitoring,,false,freezone,RAKEZ FZ list + ISIC Rev.5 AML mapping + rule library,RAKEZ code 742102 → ISIC 742 (Group)
5211-06,Roastery,"Includes small shops engaged in roasting nuts, coffee beans, spices, cereals or others, and make the packing in small consumer packs, as well as carry out roasting for others, also, reselling gifts, novelties, artificial flowers and some foodstuff items, such shops are small that they are not classified as industrial firms of category (D).",Commercial,Roastry,521,Warehousing and storage,Group,Medium,2,Transportation / storage,Standard CDD + monitoring,,false,freezone,RAKEZ FZ list + ISIC Rev.5 AML mapping + rule library,RAKEZ code 5211-06 → ISIC 521 (Group)
172302,Ropes Manufacturing,"Includes the manufacture of all kinds of ropes from fibrous materials such as cotton, jute, linen, paper, plastic, twine, including even the fiber glass. This includes processes of fiber curling, dyeing, packing and wrapping (Metal rope manufacturing is classified under class number 2899).",Industrial,Cotton & metal nets & ropes manufacturing,17,Manufacture of paper and paper products,Division,Medium,2,Manufacturing,Standard CDD + monitoring,,false,freezone,RAKEZ FZ list + ISIC Rev.5 AML mapping + rule library,RAKEZ code 172302 → ISIC 17 (Division)
514927,"Ropes, Sacks & Jute Bags Trading","Includes reselling of bags and ropes made of natural fibers, linen, plastic or other materials.",Commercial,"Bags, backaging materials & paper trading",51,Air transport,Division,Medium,2,Transportation / storage,Standard CDD + monitoring,,false,freezone,RAKEZ FZ list + ISIC Rev.5 AML mapping + rule library,RAKEZ code 514927 → ISIC 51 (Division)
1549-08,Rose Water Bottling,Includes bottling rose water after distilling rose petals and water.,Industrial,Foodstuff mills and packaging 9312028 Rugby Football Club Rugby Football Club Service Sport Club,15,Manufacture of leather and related products,Division,Medium,2,Manufacturing,Standard CDD + monitoring,,false,freezone,RAKEZ FZ list + ISIC Rev.5 AML mapping + rule library,RAKEZ code 1549-08 → ISIC 15 (Division)
251901,Rubber Products Manufacturing,"Includes manufacturing natural or artificial rubber products, such as mats, rubber rings and glass fixation requisites.",Industrial,Manufacture of tyres and rubber products,251,"Manufacture of structural metal products, tanks, reservoirs and steam generators",Group,Medium,2,Manufacturing,Standard CDD + monitoring,,false,freezone,RAKEZ FZ list + ISIC Rev.5 AML mapping + rule library,RAKEZ code 251901 → ISIC 251 (Group)
514911,Rubber Trading,"Includes reselling natural and synthetic rubber to use in manufacturing such as tires, belts, bags shoes, synthetic sponge.",Commercial,Chemicals trading,51,Air transport,Division,Medium,2,Transportation / storage,Standard CDD + monitoring,,false,freezone,RAKEZ FZ list + ISIC Rev.5 AML mapping + rule library,RAKEZ code 514911 → ISIC 51 (Division)
513950,"Saddles & Animals, Birds Training Requisites Trading","Includes reselling saddles, reins and accessories for horses, camels and other animals, involving veils, stands, straps and gloves for breeding and training.",Commercial,Sports equipment trading,51,Air transport,Division,Medium,2,Transportation / storage,Standard CDD + monitoring,,false,freezone,RAKEZ FZ list + ISIC Rev.5 AML mapping + rule library,RAKEZ code 513950 → ISIC 51 (Division)
742206,Safety Consultancies,"Includes providing safety and vocational health services and consultancies, such as examination of construction or industrial machinery, non- destructive examination and inspection, issuance of certificates of safety and vocational health measures applied therein, elaborating technical and economic feasibility studies on these machinery and equipment, technical supervision of the repair works , designing safety instructions posters.",Service,"Consultancy -D- management, information and marketing",742,Photographic activities,Group,Medium,2,Professional / technical services,Standard CDD + monitoring,MH05,false,freezone,RAKEZ FZ list + ISIC Rev.5 AML mapping + rule library,RAKEZ code 742206 → ISIC 742 (Group)
261002,Safety Glass Manufacturing,"Includes manufacturing safety glass either by laminating a plastic layer between two sheets of glass , or by tempered glass, such glass is safe in using in the automobile windshields as it break into rounded grains rather than sharp shards.",Industrial,Glass industries,261,Manufacture of electronic components and boards,Group,Medium,2,Manufacturing,Standard CDD + monitoring,,false,freezone,RAKEZ FZ list + ISIC Rev.5 AML mapping + rule library,RAKEZ code 261002 → ISIC 261 (Group)
369929,Safety Harness Fabrication,"Includes fabricating harness from ropes, webbing and locking hardware in order to use in protecting persons or animals or objects from injury or damage when ascending or descending above or the underground.",Industrial,Personal requisities manufacturing,36,"Water collection, treatment and supply",Division,Medium,2,Water / waste / remediation,Standard CDD + monitoring,,false,freezone,RAKEZ FZ list + ISIC Rev.5 AML mapping + rule library,RAKEZ code 369929 → ISIC 36 (Division)
100004,Sales Promotion Sales Promotion Media,,Media,& Marketing Services,10,Manufacture of food products,Division,Medium,2,Manufacturing,Standard CDD + monitoring,,false,freezone,RAKEZ FZ list + ISIC Rev.5 AML mapping + rule library,RAKEZ code 100004 → ISIC 10 (Division)
809042,Sales Training,"Includes providing training on wholesale or retail sale or other, including, stock management, pricing practice, loss prevention, sale systems and procedures, current trends of the wholesale and retail sale. Educational Training Instititute /",Educational,consultancy,80,Investigation and security activities,Division,Medium,2,Security / investigation / private protection,Standard CDD + monitoring,,false,freezone,RAKEZ FZ list + ISIC Rev.5 AML mapping + rule library,RAKEZ code 809042 → ISIC 80 (Division)
242911,Salt Cubes Manufacturing,"Includes obtaining salt cubes by washing high quality solar salt with controlled brine for using in Water treatment, textile dyeing, salt agent for soap, weed killers, cattle feeds.",Industrial,Manufacturing of chemicals,242,Manufacture of basic precious and other non-ferrous metals,Group,Medium,2,Manufacturing,Standard CDD + monitoring,,false,freezone,RAKEZ FZ list + ISIC Rev.5 AML mapping + rule library,RAKEZ code 242911 → ISIC 242 (Group)
142203,Salt Packaging,"Includes packaging salt in consumer packs and set for final consumption, it can be granulated, in cubes, or powdered, it should not involve any form of processing prior to packaging.",Industrial,Foodstuff mills and packaging,142,Manufacture of articles of fur,Group,Medium,2,Manufacturing,Standard CDD + monitoring,,false,freezone,RAKEZ FZ list + ISIC Rev.5 AML mapping + rule library,RAKEZ code 142203 → ISIC 142 (Group)
142201,Salt Refining,"Includes refining table salt, which is extracted from salty waters or saltpeters, or produced by sea water desalination, and packaging for consumption purposes.",Industrial,Food industries,142,Manufacture of articles of fur,Group,Medium,2,Manufacturing,Standard CDD + monitoring,,false,freezone,RAKEZ FZ list + ISIC Rev.5 AML mapping + rule library,RAKEZ code 142201 → ISIC 142 (Group)
5122-22,Salt Trading,Includes reselling refined salt for food salting and preservation as well as skins of animals tanning and fishes salting.,Commercial,Floor mills,512,Freight air transport,Group,Medium,2,Transportation / storage,Standard CDD + monitoring,,false,freezone,RAKEZ FZ list + ISIC Rev.5 AML mapping + rule library,RAKEZ code 5122-22 → ISIC 512 (Group)
5122-08,Salted & Preserved Fish & Seafood Trading,"Includes reselling of salted, dried or smoked fishs and seafood.",Commercial,Foodstuff trading,512,Freight air transport,Group,Medium,2,Transportation / storage,Standard CDD + monitoring,,false,freezone,RAKEZ FZ list + ISIC Rev.5 AML mapping + rule library,RAKEZ code 5122-08 → ISIC 512 (Group)
512208,"Salted, Preserved Fish & Seafood Trading","Includes reselling of salted, dried or smoked fishs and seafood.",Commercial,Fish trading,512,Freight air transport,Group,Medium,2,Transportation / storage,Standard CDD + monitoring,,false,freezone,RAKEZ FZ list + ISIC Rev.5 AML mapping + rule library,RAKEZ code 512208 → ISIC 512 (Group)
514304,"Sand, Gravel & Stones Trading","Includes reselling sand, gravel and stones for buildings construction and maintenance.",Commercial,Building materials trading,51,Air transport,Division,Medium,2,Transportation / storage,Standard CDD + monitoring,MH05,false,freezone,RAKEZ FZ list + ISIC Rev.5 AML mapping + rule library,RAKEZ code 514304 → ISIC 51 (Division)
5520-04,Sandwich Shop,"Includes shops that provide sandwiches, juices and beverages for immediate consumption",Commercial,Restaurants and coffee shops,5520,Other short term accommodation activities,Class,Medium,2,Accommodation / food services,Standard CDD + monitoring,,false,freezone,RAKEZ FZ list + ISIC Rev.5 AML mapping + rule library,RAKEZ code 5520-04 → ISIC 5520 (Class)
210905,Sanitary Napkins Manufacturing,Includes manufacturing ladies sanitary napkins made of cloth or synthetic disposable materials.,Industrial,Manufacturing of paper and paper products,210,"Manufacture of pharmaceuticals, medicinal chemical and botanical products",Group,Medium,2,Manufacturing,Standard CDD + monitoring,,false,freezone,RAKEZ FZ list + ISIC Rev.5 AML mapping + rule library,RAKEZ code 210905 → ISIC 210 (Group)
514313,Sanitary Ware Trading,"Includes reselling of sanitarywares, washbasins, bathtubs, lavatories taps, spigots, bathroom and kitchen articles (except furniture), as well as water drainage tubes, pipes, joints, drainage covering requisites and others.",Commercial,Elecricals trading,51,Air transport,Division,Medium,2,Transportation / storage,Standard CDD + monitoring,,false,freezone,RAKEZ FZ list + ISIC Rev.5 AML mapping + rule library,RAKEZ code 514313 → ISIC 51 (Division)
